{"$schema":"https://json-schema.org/draft/2020-12/schema","$id":"https://github.com/rezahh107/EV4-Architect-Repo/schemas/ev4-architect-stage-payload.v1.schema.json","title":"EV4 Architect Stage Payload v1","description":"Architect-owned deterministic payload for inclusion in the common Project Gate Stage Evidence Bundle envelope. It contains Architect evidence and decisions only; it is not CE proof, Builder runtime intake, Responsive completion, or production readiness.","type":"object","additionalProperties":false,"required":["schema_id","schema_version","owner_repository","payload_status","synthetic","payload_identity","source_stage_lineage","architecture_identity","approved_structure_model","architect_intent","evidence_register","unresolved_evidence","forbidden_work","boundary_assertions","validation_contract","extension_records"],"properties":{"schema_id":{"const":"ev4-architect-stage-payload@1.0.0"},"schema_version":{"const":"1.0.0"},"owner_repository":{"const":"rezahh107/EV4-Architect-Repo"},"payload_status":{"enum":["complete","insufficient_evidence"]},"synthetic":{"type":"boolean"},"payload_identity":{"$ref":"#/$defs/payload_identity"},"source_stage_lineage":{"type":"array","minItems":1,"items":{"$ref":"#/$defs/source_lineage_item"}},"architecture_identity":{"$ref":"#/$defs/architecture_identity"},"approved_structure_model":{"$ref":"#/$defs/approved_structure_model"},"architect_intent":{"$ref":"#/$defs/architect_intent"},"evidence_register":{"type":"array","minItems":1,"uniqueItems":true,"items":{"$ref":"#/$defs/evidence_record"}},"unresolved_evidence":{"type":"array","items":{"$ref":"#/$defs/unresolved_evidence"}},"forbidden_work":{"type":"array","minItems":6,"uniqueItems":true,"items":{"enum":["no_invent_geometry","no_invent_assets","no_invent_breakpoints","no_infer_dynamic_data","no_claim_builder_ready","no_claim_production_ready","no_claim_constructability_proven","no_claim_responsive_complete","no_create_builder_runtime_intake"]}},"boundary_assertions":{"$ref":"#/$defs/boundary_assertions"},"validation_contract":{"$ref":"#/$defs/validation_contract"},"extension_records":{"type":"array","items":{"$ref":"#/$defs/extension_record"}}},"allOf":[{"if":{"properties":{"payload_status":{"const":"insufficient_evidence"}},"required":["payload_status"]},"then":{"properties":{"unresolved_evidence":{"minItems":1}}}}],"$defs":{"id_string":{"type":"string","minLength":1,"pattern":"^[A-Za-z][A-Za-z0-9._:-]*$"},"non_empty_string":{"type":"string","minLength":1,"pattern":"\\S"},"class_name":{"type":"string","minLength":1,"pattern":"^[a-z][a-z0-9-]*(?:__[a-z0-9-]+)?(?:--[a-z0-9-]+)?$"},"evidence_ref":{"type":"string","minLength":1,"pattern":"^[A-Za-z][A-Za-z0-9._:-]*$"},"evidence_refs":{"type":"array","minItems":1,"uniqueItems":true,"items":{"$ref":"#/$defs/evidence_ref"}},"state":{"enum":["observed","validated","resolved","derived","proposed","unverified","insufficient_evidence"]},"stage_name":{"enum":["/intake","/research","/decompose","/architectures","/score-evidence","/score-audit","/recommend","/build-tree","/implementation","/final-audit","/handoff-export","/builder-feed-export"]},"payload_identity":{"type":"object","additionalProperties":false,"required":["producer","stage","contract_purpose","created_by","synthetic_fixture_notice"],"properties":{"producer":{"const":"ev4_architect"},"stage":{"const":"architect"},"contract_purpose":{"const":"project_gate_stage_payload"},"created_by":{"type":"string","minLength":1,"pattern":"\\S"},"synthetic_fixture_notice":{"type":"string","minLength":1}}},"source_lineage_item":{"type":"object","additionalProperties":false,"required":["stage","payload_name","schema_id","state","evidence_refs"],"properties":{"stage":{"$ref":"#/$defs/stage_name"},"payload_name":{"type":"string","minLength":1,"pattern":"\\S"},"schema_id":{"type":"string","minLength":1,"pattern":"\\S"},"state":{"$ref":"#/$defs/state"},"evidence_refs":{"$ref":"#/$defs/evidence_refs"}}},"architecture_identity":{"type":"object","additionalProperties":false,"required":["selected_candidate_id","selected_candidate_locked","architecture_family","decision_source","semantic_lock"],"properties":{"selected_candidate_id":{"$ref":"#/$defs/id_string"},"selected_candidate_locked":{"const":true},"architecture_family":{"type":"string","minLength":1,"pattern":"\\S"},"decision_source":{"type":"object","additionalProperties":false,"required":["stage","payload_name","schema_id","evidence_refs","locked_decision_refs","approved_structure_ref","source_evidence_refs"],"properties":{"stage":{"const":"/recommend"},"payload_name":{"const":"Recommendation_Payload"},"schema_id":{"type":"string","minLength":1,"pattern":"\\S"},"evidence_refs":{"$ref":"#/$defs/evidence_refs"},"locked_decision_refs":{"$ref":"#/$defs/evidence_refs"},"approved_structure_ref":{"$ref":"#/$defs/id_string"},"source_evidence_refs":{"$ref":"#/$defs/evidence_refs"}}},"semantic_lock":{"type":"object","additionalProperties":false,"required":["boolean_lock_alone_sufficient","requires_candidate_identity","requires_decision_source","requires_locked_decision_refs","requires_approved_structure_ref","requires_source_evidence_refs"],"properties":{"boolean_lock_alone_sufficient":{"const":false},"requires_candidate_identity":{"const":true},"requires_decision_source":{"const":true},"requires_locked_decision_refs":{"const":true},"requires_approved_structure_ref":{"const":true},"requires_source_evidence_refs":{"const":true}}}}},"approved_structure_model":{"type":"object","additionalProperties":false,"required":["structure_schema_version","root_node_id","structure_nodes"],"properties":{"structure_schema_version":{"const":"architect-structure-model.v1"},"root_node_id":{"$ref":"#/$defs/id_string"},"structure_nodes":{"type":"array","minItems":1,"items":{"$ref":"#/$defs/structure_node"}}}},"structure_node":{"type":"object","additionalProperties":false,"required":["node_id","parent_node_id","node_kind","role","hierarchy_path","evidence_refs","intent_refs","children"],"properties":{"node_id":{"$ref":"#/$defs/id_string"},"parent_node_id":{"anyOf":[{"type":"null"},{"$ref":"#/$defs/id_string"}]},"node_kind":{"enum":["section_root","structural_container","content_group","widget","decoration_layer","overlay_stage","connector_layer","wrapper","component_candidate"]},"role":{"type":"string","minLength":1,"pattern":"\\S"},"hierarchy_path":{"type":"array","minItems":1,"items":{"type":"string","minLength":1,"pattern":"\\S"}},"evidence_refs":{"$ref":"#/$defs/evidence_refs"},"intent_refs":{"type":"array","items":{"$ref":"#/$defs/id_string"}},"children":{"type":"array","uniqueItems":true,"items":{"$ref":"#/$defs/id_string"}},"wrapper_justification":{"type":"object","additionalProperties":false,"required":["reason","evidence_refs","can_remove_if_implementation_simplifies"],"properties":{"reason":{"enum":["normal-flow grouping","responsive order control","overlay containment","decoration isolation","repeated component boundary","design-system reuse","widget-native requirement","accessibility/semantic grouping"]},"evidence_refs":{"$ref":"#/$defs/evidence_refs"},"can_remove_if_implementation_simplifies":{"type":"boolean"}}}}},"architect_intent":{"type":"object","additionalProperties":false,"required":["normal_flow_intent","overlay_intent","editable_content_intent","class_intent","asset_intent","scoped_css_intent","responsive_risk_seeds","dynamic_loop_intent"],"properties":{"normal_flow_intent":{"$ref":"#/$defs/intent_statement"},"overlay_intent":{"$ref":"#/$defs/overlay_intent"},"editable_content_intent":{"$ref":"#/$defs/editable_content_intent"},"class_intent":{"$ref":"#/$defs/class_intent"},"asset_intent":{"$ref":"#/$defs/asset_intent"},"scoped_css_intent":{"$ref":"#/$defs/scoped_css_intent"},"responsive_risk_seeds":{"type":"array","minItems":1,"items":{"$ref":"#/$defs/responsive_risk_seed"}},"dynamic_loop_intent":{"$ref":"#/$defs/dynamic_loop_intent"}}},"intent_statement":{"type":"object","additionalProperties":false,"required":["intent_id","state","summary","evidence_refs"],"properties":{"intent_id":{"$ref":"#/$defs/id_string"},"state":{"$ref":"#/$defs/state"},"summary":{"type":"string","minLength":1,"pattern":"\\S"},"evidence_refs":{"$ref":"#/$defs/evidence_refs"}}},"overlay_intent":{"type":"object","additionalProperties":false,"required":["intent_id","state","overlay_allowed","contained_in_named_stage_required","meaningful_content_in_overlay_allowed","evidence_refs"],"properties":{"intent_id":{"$ref":"#/$defs/id_string"},"state":{"$ref":"#/$defs/state"},"overlay_allowed":{"type":"boolean"},"contained_in_named_stage_required":{"const":true},"meaningful_content_in_overlay_allowed":{"const":false},"evidence_refs":{"$ref":"#/$defs/evidence_refs"}}},"editable_content_intent":{"type":"object","additionalProperties":false,"required":["intent_id","state","meaningful_content_editable_when_practical","static_image_for_meaningful_content_allowed","evidence_refs"],"properties":{"intent_id":{"$ref":"#/$defs/id_string"},"state":{"$ref":"#/$defs/state"},"meaningful_content_editable_when_practical":{"const":true},"static_image_for_meaningful_content_allowed":{"const":false},"evidence_refs":{"$ref":"#/$defs/evidence_refs"}}},"class_intent":{"type":"object","additionalProperties":false,"required":["approved_class_names","class_application_map"],"properties":{"approved_class_names":{"type":"array","minItems":1,"uniqueItems":true,"items":{"$ref":"#/$defs/class_name"}},"class_application_map":{"type":"array","minItems":1,"items":{"type":"object","additionalProperties":false,"required":["class_name","target_node_ids","scope","evidence_refs"],"properties":{"class_name":{"$ref":"#/$defs/class_name"},"target_node_ids":{"type":"array","minItems":1,"uniqueItems":true,"items":{"$ref":"#/$defs/id_string"}},"scope":{"enum":["section","component","widget","utility","global_candidate"]},"evidence_refs":{"$ref":"#/$defs/evidence_refs"}}}}}},"asset_intent":{"type":"object","additionalProperties":false,"required":["asset_requirements","missing_asset_policy"],"properties":{"asset_requirements":{"type":"array","items":{"type":"object","additionalProperties":false,"required":["asset_id","role","state","evidence_refs"],"properties":{"asset_id":{"$ref":"#/$defs/id_string"},"role":{"enum":["meaningful","decorative","visual_core","unknown"]},"state":{"$ref":"#/$defs/state"},"evidence_refs":{"$ref":"#/$defs/evidence_refs"}}}},"missing_asset_policy":{"const":"missing_assets_remain_explicit_evidence_gaps"}}},"scoped_css_intent":{"type":"object","additionalProperties":false,"required":["css_allowed","allowed_selector_scopes","global_css_allowed","meaningful_content_created_by_css_allowed","css_need_map"],"properties":{"css_allowed":{"type":"boolean"},"allowed_selector_scopes":{"type":"array","minItems":1,"items":{"enum":["selected_class","child_of_selected_class","state","responsive_device","media_query"]}},"global_css_allowed":{"const":false},"meaningful_content_created_by_css_allowed":{"const":false},"css_need_map":{"type":"array","items":{"type":"object","additionalProperties":false,"required":["css_need_id","target_node_id","allowed_selector_scope","purpose","state","evidence_refs"],"properties":{"css_need_id":{"$ref":"#/$defs/id_string"},"target_node_id":{"$ref":"#/$defs/id_string"},"allowed_selector_scope":{"enum":["selected_class","child_of_selected_class","state","responsive_device","media_query"]},"purpose":{"type":"string","minLength":1,"pattern":"\\S"},"state":{"$ref":"#/$defs/state"},"evidence_refs":{"$ref":"#/$defs/evidence_refs"}}}}}},"responsive_risk_seed":{"type":"object","additionalProperties":false,"required":["risk_id","risk_type","state","description","downstream_owner","evidence_refs"],"properties":{"risk_id":{"$ref":"#/$defs/id_string"},"risk_type":{"enum":["mobile_behavior_not_proven","tablet_behavior_not_proven","breakpoints_not_provided","connector_behavior_not_proven","meaningful_content_visibility_unknown","collision_risk_unknown"]},"state":{"$ref":"#/$defs/state"},"description":{"type":"string","minLength":1,"pattern":"\\S"},"downstream_owner":{"enum":["ce","builder","responsive","unresolved"]},"evidence_refs":{"$ref":"#/$defs/evidence_refs"}}},"dynamic_loop_intent":{"type":"object","additionalProperties":false,"required":["status","evidence_refs","reason"],"properties":{"status":{"enum":["none","not_applicable","possible","unknown","approved"]},"evidence_refs":{"type":"array","uniqueItems":true,"items":{"$ref":"#/$defs/evidence_ref"}},"reason":{"type":"string","minLength":1,"pattern":"\\S"}}},"evidence_record":{"type":"object","additionalProperties":false,"required":["evidence_id","state","source_ref","claim","fact_class"],"properties":{"evidence_id":{"$ref":"#/$defs/evidence_ref"},"state":{"$ref":"#/$defs/state"},"source_ref":{"type":"object","additionalProperties":false,"required":["source_type","reference"],"properties":{"source_type":{"enum":["stage_payload","repo_path","contract","schema","fixture","manual_observation","synthetic_fixture"]},"reference":{"type":"string","minLength":1,"pattern":"\\S"}}},"claim":{"type":"string","minLength":1,"pattern":"\\S"},"fact_class":{"enum":["project_specific_behavior","platform_capability","project_default","project_conceptual_model","unresolved_unknown","audit_finding","contract_rule","not_claimed","synthetic_fixture"]}}},"unresolved_evidence":{"type":"object","additionalProperties":false,"required":["unresolved_id","state","owner","reason","blocks","required_before","evidence_refs"],"properties":{"unresolved_id":{"$ref":"#/$defs/id_string"},"state":{"const":"insufficient_evidence"},"owner":{"enum":["architect","ce","builder","responsive","user","unresolved"]},"reason":{"type":"string","minLength":1,"pattern":"\\S"},"blocks":{"type":"array","minItems":1,"items":{"enum":["architect_stage_payload_acceptance","ce_transition","builder_execution","responsive_validation","production_readiness"]}},"required_before":{"enum":["project_gate_acceptance","ce_transition","builder_execution","responsive_validation","production_release"]},"evidence_refs":{"type":"array","uniqueItems":true,"items":{"$ref":"#/$defs/evidence_ref"}}}},"boundary_assertions":{"type":"object","additionalProperties":false,"required":["constructability_proven","ce_approved","ce_review_required","builder_ready","builder_executable","builder_runtime_intake_authorized","responsive_complete","production_ready","live_elementor_validated","real_export_json_validated","exact_pixel_match_validated","project_gate_may_invent_architect_facts"],"properties":{"constructability_proven":{"const":false},"ce_approved":{"const":false},"ce_review_required":{"const":true},"builder_ready":{"const":false},"builder_executable":{"const":false},"builder_runtime_intake_authorized":{"const":false},"responsive_complete":{"const":false},"production_ready":{"const":false},"live_elementor_validated":{"const":false},"real_export_json_validated":{"const":false},"exact_pixel_match_validated":{"const":false},"project_gate_may_invent_architect_facts":{"const":false}}},"validation_contract":{"type":"object","additionalProperties":false,"required":["schema_validation_required","semantic_validation_required","additional_properties_allowed_in_core","rules"],"properties":{"schema_validation_required":{"const":true},"semantic_validation_required":{"const":true},"additional_properties_allowed_in_core":{"const":false},"rules":{"type":"array","minItems":12,"uniqueItems":true,"items":{"enum":["A-R01","A-R02","A-R03","A-R04","A-R05","A-R06","A-R07","A-R08","A-R09","A-R10","A-R11","A-R12"]}}}},"extension_record":{"type":"object","additionalProperties":false,"required":["extension_id","owner","evidence_state","evidence_refs","allowed_consumer","cannot_override_core_fields","downstream_readiness_claims_allowed","data"],"properties":{"extension_id":{"$ref":"#/$defs/id_string"},"owner":{"type":"string","minLength":1,"pattern":"\\S"},"evidence_state":{"$ref":"#/$defs/state"},"evidence_refs":{"$ref":"#/$defs/evidence_refs"},"allowed_consumer":{"enum":["architect","project_gate","ce","builder","responsive"]},"cannot_override_core_fields":{"const":true},"downstream_readiness_claims_allowed":{"const":false},"data":{"type":"object","additionalProperties":true}}}}}
