{"schema_id":"ev4-architect-stage-payload@1.0.0","schema_version":"1.0.0","owner_repository":"rezahh107/EV4-Architect-Repo","payload_status":"complete","synthetic":true,"payload_identity":{"producer":"ev4_architect","stage":"architect","contract_purpose":"project_gate_stage_payload","created_by":"ev4-architect-tests","synthetic_fixture_notice":"Synthetic fixture; not a real Architect export."},"source_stage_lineage":[{"stage":"/recommend","payload_name":"Recommendation_Payload","schema_id":"ev4-recommend-payload@1.0.0","state":"observed","evidence_refs":["ev-rec"]}],"architecture_identity":{"selected_candidate_id":"ARCH-FAM-C","selected_candidate_locked":true,"architecture_family":"Relative Stage + SVG Connector Layer","decision_source":{"stage":"/recommend","payload_name":"Recommendation_Payload","schema_id":"ev4-recommend-payload@1.0.0","evidence_refs":["ev-rec"],"locked_decision_refs":["ev-lock"],"approved_structure_ref":"node-root","source_evidence_refs":["ev-stage7"]},"semantic_lock":{"boolean_lock_alone_sufficient":false,"requires_candidate_identity":true,"requires_decision_source":true,"requires_locked_decision_refs":true,"requires_approved_structure_ref":true,"requires_source_evidence_refs":true}},"approved_structure_model":{"structure_schema_version":"architect-structure-model.v1","root_node_id":"node-root","structure_nodes":[{"node_id":"node-root","parent_node_id":null,"node_kind":"section_root","role":"smart_home_section","hierarchy_path":["Smart Home Section"],"evidence_refs":["ev-stage7"],"intent_refs":["intent-normal","intent-overlay","intent-editable"],"children":["node-wrapper"]},{"node_id":"node-wrapper","parent_node_id":"node-root","node_kind":"wrapper","role":"normal_flow_grouping_wrapper","hierarchy_path":["Smart Home Section","Wrapper"],"evidence_refs":["ev-stage7"],"intent_refs":["intent-normal"],"children":[],"wrapper_justification":{"reason":"normal-flow grouping","evidence_refs":["ev-stage7"],"can_remove_if_implementation_simplifies":true}}]},"architect_intent":{"normal_flow_intent":{"intent_id":"intent-normal","state":"observed","summary":"Primary meaningful content remains in normal flow.","evidence_refs":["ev-stage7"]},"overlay_intent":{"intent_id":"intent-overlay","state":"observed","overlay_allowed":true,"contained_in_named_stage_required":true,"meaningful_content_in_overlay_allowed":false,"evidence_refs":["ev-stage7"]},"editable_content_intent":{"intent_id":"intent-editable","state":"observed","meaningful_content_editable_when_practical":true,"static_image_for_meaningful_content_allowed":false,"evidence_refs":["ev-stage7"]},"class_intent":{"approved_class_names":["smart-home__section","smart-home__stage--relative"],"class_application_map":[{"class_name":"smart-home__section","target_node_ids":["node-root"],"scope":"section","evidence_refs":["ev-stage7"]}]},"asset_intent":{"asset_requirements":[{"asset_id":"asset-dashboard","role":"visual_core","state":"unverified","evidence_refs":["ev-stage7"]}],"missing_asset_policy":"missing_assets_remain_explicit_evidence_gaps"},"scoped_css_intent":{"css_allowed":true,"allowed_selector_scopes":["selected_class","child_of_selected_class"],"global_css_allowed":false,"meaningful_content_created_by_css_allowed":false,"css_need_map":[{"css_need_id":"css-connector","target_node_id":"node-root","allowed_selector_scope":"selected_class","purpose":"Contained connector styling only.","state":"proposed","evidence_refs":["ev-stage8"]}]},"responsive_risk_seeds":[{"risk_id":"risk-mobile-connectors","risk_type":"connector_behavior_not_proven","state":"insufficient_evidence","description":"Mobile connector behavior is not proven.","downstream_owner":"responsive","evidence_refs":["ev-stage7"]}],"dynamic_loop_intent":{"status":"none","evidence_refs":[],"reason":"Repeated visual groups alone do not prove Dynamic Loop need."}},"evidence_register":[{"evidence_id":"ev-rec","state":"observed","source_ref":{"source_type":"stage_payload","reference":"/recommend synthetic"},"claim":"Stage 6 selected ARCH-FAM-C.","fact_class":"project_specific_behavior"},{"evidence_id":"ev-lock","state":"observed","source_ref":{"source_type":"stage_payload","reference":"/recommend lock synthetic"},"claim":"Selected candidate lock is present.","fact_class":"project_specific_behavior"},{"evidence_id":"ev-stage7","state":"observed","source_ref":{"source_type":"repo_path","reference":"stages/07_BUILD_TREE.md"},"claim":"Stage 7 owns approved structure and class intent.","fact_class":"contract_rule"},{"evidence_id":"ev-stage8","state":"observed","source_ref":{"source_type":"repo_path","reference":"stages/08_IMPLEMENTATION.md"},"claim":"Scoped CSS need is intent, not final CSS execution.","fact_class":"contract_rule"}],"unresolved_evidence":[{"unresolved_id":"unresolved-mobile-connectors","state":"insufficient_evidence","owner":"responsive","reason":"Mobile connector behavior lacks screenshot/export evidence.","blocks":["responsive_validation","production_readiness"],"required_before":"responsive_validation","evidence_refs":["ev-stage7"]}],"forbidden_work":["no_invent_geometry","no_invent_assets","no_invent_breakpoints","no_infer_dynamic_data","no_claim_builder_ready","no_claim_production_ready","no_claim_constructability_proven","no_claim_responsive_complete","no_create_builder_runtime_intake"],"boundary_assertions":{"constructability_proven":false,"ce_approved":false,"ce_review_required":true,"builder_ready":false,"builder_executable":false,"builder_runtime_intake_authorized":false,"responsive_complete":false,"production_ready":false,"live_elementor_validated":false,"real_export_json_validated":false,"exact_pixel_match_validated":false,"project_gate_may_invent_architect_facts":false},"validation_contract":{"schema_validation_required":true,"semantic_validation_required":true,"additional_properties_allowed_in_core":false,"rules":["A-R01","A-R02","A-R03","A-R04","A-R05","A-R06","A-R07","A-R08","A-R09","A-R10","A-R11","A-R12"]},"extension_records":[]}
